{
  "formato": "nat78-primeira-passada-respostas-1.3.0",
  "lote": "lote-04",
  "loteSha256": "45dae8b47f25e2b5059a4ed6fe7728055f6e42bae311beda3493b6f32187b960",
  "juiz": "assistente, subagente novo e cego (Opus), lote-04",
  "respostas": [
    {
      "id": "T3-c051ba0b17",
      "sugestao": "nao-perguntado",
      "forcaDoVeredito": "inferido",
      "estadoAlcancado": "nao-alcancado",
      "verdadeFactual": "indisponivel",
      "norma": {
        "id": "citada",
        "forca": "obrigatorio",
        "aplicabilidade": "incerta",
        "violada": "incerto"
      },
      "vinculo": {
        "spec": "A-04",
        "relacao": "direta"
      },
      "referencias": "nao-perguntado",
      "evidencias": [
        "OBS",
        "S1",
        "S2",
        "A-04",
        "MEDIDA"
      ],
      "justificativa": "A receita do estado é vazia (só carregar a página), mas OBS pressupõe foco em S1/S2; sem foco o estado descrito não é alcançado (R10). A MEDIDA feita com Tab, fora da receita, mostra o fato de A-04, o que não muda a resposta."
    },
    {
      "id": "T3-c1264c6974",
      "sugestao": "nao-perguntado",
      "forcaDoVeredito": "medido",
      "estadoAlcancado": "receita",
      "verdadeFactual": "verdadeira",
      "norma": {
        "id": "citada",
        "forca": "obrigatorio",
        "aplicabilidade": "aplica",
        "violada": "sim"
      },
      "vinculo": {
        "spec": "A-02",
        "relacao": "direta"
      },
      "evidencias": [
        "OBS",
        "E2",
        "S1",
        "A-02",
        "MEDIDA"
      ],
      "justificativa": "MEDIDA: após carregar, o 1º Tab foca .upload-button (tabindex=\"1\", único tabindex positivo) e o 2º o link \"Ir para o conteúdo\", como OBS e E2 dizem; a ordem de foco salta para o meio do formulário, violando 2.4.3 — é o fato de A-02."
    },
    {
      "id": "T3-c32fbe3bdd",
      "sugestao": {
        "trataOFato": "sim",
        "especificaDoSujeito": "sim",
        "naoViolaNormaObrigatoria": "sim",
        "qualidade": "valida"
      },
      "forcaDoVeredito": "medido",
      "estadoAlcancado": "receita",
      "verdadeFactual": "verdadeira",
      "norma": {
        "id": "citada",
        "forca": "obrigatorio",
        "aplicabilidade": "nao-aplica",
        "violada": "nao"
      },
      "vinculo": {
        "spec": "A-06",
        "relacao": "direta"
      },
      "evidencias": [
        "OBS",
        "S1",
        "NORMA",
        "ESP",
        "A-06",
        "MEDIDA"
      ],
      "justificativa": "MEDIDA: após o envio vazio, o botão Fechar da mensagem de erro (S1) é um <div class=\"br-button circle small\" role=\"button\" tabindex=\"0\">. A regra citada trata da anatomia do componente (suas partes visuais), não da tag HTML; o que A-06 descreve é questão de semântica do elemento, então a norma citada não se aplica ao fato; ESP (usar <button>) trata o fato sem violar norma. A parte de OBS sobre a mensagem de sucesso está fora do estado da receita."
    },
    {
      "id": "T3-c3f4b756a7",
      "sugestao": "nao-perguntado",
      "forcaDoVeredito": "medido",
      "estadoAlcancado": "receita",
      "verdadeFactual": "verdadeira",
      "norma": {
        "id": "citada",
        "forca": "obrigatorio",
        "aplicabilidade": "aplica",
        "violada": "sim"
      },
      "vinculo": {
        "spec": "A-11",
        "relacao": "direta"
      },
      "evidencias": [
        "OBS",
        "S1",
        "NORMA",
        "A-11",
        "MEDIDA"
      ],
      "justificativa": "MEDIDA: após o envio vazio, a .close da mensagem de erro (S1) está em x=201, mesma borda esquerda da mensagem (x=201, largura 878), e é o primeiro filho no DOM, antes de .content e .icon; NORMA exige o Fechar no topo à direita — é o fato de A-11."
    },
    {
      "id": "T3-c915abe684",
      "sugestao": "nao-perguntado",
      "forcaDoVeredito": "medido",
      "estadoAlcancado": "receita",
      "verdadeFactual": "verdadeira",
      "norma": {
        "id": "citada",
        "forca": "obrigatorio",
        "aplicabilidade": "aplica",
        "violada": "sim"
      },
      "vinculo": "nenhum",
      "evidencias": [
        "OBS",
        "S1",
        "MEDIDA",
        "A-02",
        "A-10"
      ],
      "justificativa": "MEDIDA: o <button class=\"upload-button\"> (S1) tem aria-hidden=\"true\" e tabindex=\"1\", #documentos tem display:none, e na árvore de acessibilidade o botão é ignorado (ariaHiddenElement), logo o único controle focalizável do upload não expõe nome nem papel. OBS fala em \"botão sem nome\"; na MEDIDA ele nem aparece, o que dá o mesmo resultado. A-02 (tabindex) e A-10 (texto de apoio) tratam de outros fatos do mesmo botão."
    },
    {
      "id": "T3-ca0fa42f1c",
      "sugestao": "nao-perguntado",
      "forcaDoVeredito": "medido",
      "estadoAlcancado": "receita",
      "verdadeFactual": "verdadeira",
      "norma": {
        "id": "citada",
        "forca": "indeterminado",
        "aplicabilidade": "incerta",
        "violada": "incerto"
      },
      "vinculo": {
        "spec": "A-02",
        "relacao": "participante-relacionado"
      },
      "evidencias": [
        "OBS",
        "NORMA",
        "A-02",
        "MEDIDA"
      ],
      "justificativa": "MEDIDA: o primeiro link é o atalho href=\"#main-content\", mas o 1º Tab da página cai em .upload-button (tabindex=\"1\"), que continua com tabindex=\"1\" no estado do diálogo aberto; o fato de OBS é o de A-02, visto a partir do atalho. NORMA vem sem texto nem regra da base (\"texto não localizado\"), então a força não pode ser decidida."
    },
    {
      "id": "T3-cb9d709283",
      "sugestao": "nao-perguntado",
      "forcaDoVeredito": "medido",
      "estadoAlcancado": "receita",
      "verdadeFactual": "verdadeira",
      "norma": {
        "id": "citada",
        "forca": "obrigatorio",
        "aplicabilidade": "aplica",
        "violada": "sim"
      },
      "vinculo": "nenhum",
      "referencias": "nao-perguntado",
      "evidencias": [
        "OBS",
        "S1",
        "MEDIDA"
      ],
      "justificativa": "MEDIDA: o <button class=\"upload-button\"> (S1) tem aria-hidden=\"true\" e tabindex=\"1\", #documentos tem display:none, e na árvore de acessibilidade o botão é ignorado (ariaHiddenElement), logo o único controle focalizável do upload não expõe nome nem papel. Nenhum defeito da referência trata do aria-hidden do botão."
    },
    {
      "id": "T3-ceb2afdc2e",
      "sugestao": {
        "trataOFato": "sim",
        "especificaDoSujeito": "sim",
        "naoViolaNormaObrigatoria": "sim",
        "qualidade": "valida"
      },
      "forcaDoVeredito": "medido",
      "estadoAlcancado": "receita",
      "verdadeFactual": "verdadeira",
      "norma": {
        "id": "citada",
        "forca": "obrigatorio",
        "aplicabilidade": "nao-aplica",
        "violada": "nao"
      },
      "vinculo": {
        "spec": "A-06",
        "relacao": "direta"
      },
      "evidencias": [
        "OBS",
        "S1",
        "NORMA",
        "ESP",
        "A-06",
        "MEDIDA"
      ],
      "justificativa": "MEDIDA: após o envio vazio, o botão Fechar da mensagem de erro (S1) é um <div class=\"br-button circle small\" role=\"button\" tabindex=\"0\">. A regra citada trata da anatomia do componente (suas partes visuais), não da tag HTML; o que A-06 descreve é questão de semântica do elemento, então a norma citada não se aplica ao fato; ESP (usar <button>) trata o fato sem violar norma. O <div> continua lá com o diálogo de descarte aberto."
    },
    {
      "id": "T3-d185e15354",
      "sugestao": "nao-perguntado",
      "forcaDoVeredito": "medido",
      "estadoAlcancado": "receita",
      "verdadeFactual": "verdadeira",
      "norma": {
        "id": "citada",
        "forca": "obrigatorio",
        "aplicabilidade": "aplica",
        "violada": "sim"
      },
      "vinculo": "nenhum",
      "evidencias": [
        "OBS",
        "S1",
        "NORMA",
        "MEDIDA"
      ],
      "justificativa": "MEDIDA: logo após o clique em .acao-enviar com o formulário vazio, document.activeElement é div.content role=\"alert\" tabindex=\"-1\", não o botão Fechar, contra o que NORMA exige (foco no Fechar). Nenhum defeito da referência trata do foco ao exibir a mensagem; a parte sobre a mensagem de sucesso está fora do estado."
    },
    {
      "id": "T3-d18a5b5903",
      "sugestao": "nao-perguntado",
      "forcaDoVeredito": "medido",
      "estadoAlcancado": "receita",
      "verdadeFactual": "verdadeira",
      "norma": {
        "id": "citada",
        "forca": "obrigatorio",
        "aplicabilidade": "aplica",
        "violada": "sim"
      },
      "vinculo": {
        "spec": "A-02",
        "relacao": "direta"
      },
      "referencias": "nao-perguntado",
      "evidencias": [
        "OBS",
        "S1",
        "A-02",
        "MEDIDA"
      ],
      "justificativa": "MEDIDA: o 1º Tab foca .upload-button (tabindex=\"1\"); só depois vêm o atalho, a marca gov.br e a trilha, como OBS diz; a ordem de foco não segue a sequência da página, violando 2.4.3 — é o fato de A-02."
    },
    {
      "id": "T3-d4fca463e0",
      "sugestao": "nao-perguntado",
      "forcaDoVeredito": "medido",
      "estadoAlcancado": "receita",
      "verdadeFactual": "verdadeira",
      "norma": {
        "id": "citada",
        "forca": "obrigatorio",
        "aplicabilidade": "aplica",
        "violada": "sim"
      },
      "vinculo": {
        "spec": "A-04",
        "relacao": "direta"
      },
      "referencias": "nao-perguntado",
      "evidencias": [
        "OBS",
        "S1",
        "S2",
        "A-04",
        "MEDIDA"
      ],